{
  "kit_schema": 1,
  "id": "scn.subscription.billing.002",
  "area": "scn",
  "title": "monthly anniversary on the 31st: one invoice per period, month-end clamping",
  "profile": "both",
  "ruling": "decided",
  "pair": null,
  "rules": ["BE-DM-15","BE-SP-31"],
  "rbd": ["RBD-64"],
  "tags": [],
  "evidence": {"kind":"EXECUTED","by":"replay-on-lago","ref":"$API/spec/scenarios/subscriptions/billing_spec.rb:66","pin":"591ae9005110","runtime":"ruby-4.0.6 (pinned)","executed_at":"2026-10-02"},
  "setup": {
    "at": "2022-12-31T00:00:00Z",
    "organization": {"document_number_prefix":"ORG-0001"},
    "premium": false,
    "store": "pg",
    "plans": [{"name":"plan_1","code":"plan_1","interval":"monthly","amount_cents":5000000,"amount_currency":"GBP","pay_in_advance":false}],
    "customers": [{"external_id":"cust_1","currency":"GBP"}]
  },
  "steps": [
    {"op":"api","method":"POST","path":"/api/v1/subscriptions","body":{"subscription":{"external_customer_id":"cust_1","external_id":"cust_1","plan_code":"plan_1","billing_time":"anniversary"}}},
    {"at":"2023-01-31T01:00:00Z","op":"tick","jobs":["billing"]},
    {"at":"2023-02-28T01:00:00Z","op":"tick","jobs":["billing"]},
    {"at":"2023-03-31T01:00:00Z","op":"tick","jobs":["billing"]},
    {"at":"2023-04-30T01:00:00Z","op":"tick","jobs":["billing"]},
    {"at":"2023-05-31T01:00:00Z","op":"tick","jobs":["billing"]},
    {"at":"2023-06-30T01:00:00Z","op":"tick","jobs":["billing"]},
    {"at":"2023-07-31T02:00:00Z","op":"tick","jobs":["billing"]},
    {"at":"2023-08-31T02:00:00Z","op":"tick","jobs":["billing"]},
    {"at":"2023-09-30T02:00:00Z","op":"tick","jobs":["billing"]},
    {"at":"2023-10-31T02:00:00Z","op":"tick","jobs":["billing"]},
    {"at":"2023-11-30T02:00:00Z","op":"tick","jobs":["billing"]},
    {"at":"2023-12-31T02:00:00Z","op":"tick","jobs":["billing"]},
    {"at":"2024-01-31T02:00:00Z","op":"tick","jobs":["billing"]},
    {"at":"2024-02-29T02:00:00Z","op":"tick","jobs":["billing"]},
    {"at":"2024-03-31T02:00:00Z","op":"tick","jobs":["billing"]}
  ],
  "expect": {
    "invoices": [
      {"issuing_date":"2023-01-31","total_amount_cents":5000000,"billing_periods":[{"subscription_from_datetime":"2022-12-31T00:00:00Z","subscription_to_datetime":"2023-01-30T23:59:59Z","charges_from_datetime":"2022-12-31T00:00:00Z","charges_to_datetime":"2023-01-30T23:59:59Z","invoicing_reason":"subscription_periodic"}]},
      {"issuing_date":"2023-02-28","total_amount_cents":5000000,"billing_periods":[{"subscription_from_datetime":"2023-01-31T00:00:00Z","subscription_to_datetime":"2023-02-27T23:59:59Z","charges_from_datetime":"2023-01-31T00:00:00Z","charges_to_datetime":"2023-02-27T23:59:59Z","invoicing_reason":"subscription_periodic"}]},
      {"issuing_date":"2023-03-31","total_amount_cents":5000000,"billing_periods":[{"subscription_from_datetime":"2023-02-28T00:00:00Z","subscription_to_datetime":"2023-03-30T23:59:59Z","charges_from_datetime":"2023-02-28T00:00:00Z","charges_to_datetime":"2023-03-30T23:59:59Z","invoicing_reason":"subscription_periodic"}]},
      {"issuing_date":"2023-04-30","total_amount_cents":5000000,"billing_periods":[{"subscription_from_datetime":"2023-03-31T00:00:00Z","subscription_to_datetime":"2023-04-29T23:59:59Z","charges_from_datetime":"2023-03-31T00:00:00Z","charges_to_datetime":"2023-04-29T23:59:59Z","invoicing_reason":"subscription_periodic"}]},
      {"issuing_date":"2023-05-31","total_amount_cents":5000000,"billing_periods":[{"subscription_from_datetime":"2023-04-30T00:00:00Z","subscription_to_datetime":"2023-05-30T23:59:59Z","charges_from_datetime":"2023-04-30T00:00:00Z","charges_to_datetime":"2023-05-30T23:59:59Z","invoicing_reason":"subscription_periodic"}]},
      {"issuing_date":"2023-06-30","total_amount_cents":5000000,"billing_periods":[{"subscription_from_datetime":"2023-05-31T00:00:00Z","subscription_to_datetime":"2023-06-29T23:59:59Z","charges_from_datetime":"2023-05-31T00:00:00Z","charges_to_datetime":"2023-06-29T23:59:59Z","invoicing_reason":"subscription_periodic"}]},
      {"issuing_date":"2023-07-31","total_amount_cents":5000000,"billing_periods":[{"subscription_from_datetime":"2023-06-30T00:00:00Z","subscription_to_datetime":"2023-07-30T23:59:59Z","charges_from_datetime":"2023-06-30T00:00:00Z","charges_to_datetime":"2023-07-30T23:59:59Z","invoicing_reason":"subscription_periodic"}]},
      {"issuing_date":"2023-08-31","total_amount_cents":5000000,"billing_periods":[{"subscription_from_datetime":"2023-07-31T00:00:00Z","subscription_to_datetime":"2023-08-30T23:59:59Z","charges_from_datetime":"2023-07-31T00:00:00Z","charges_to_datetime":"2023-08-30T23:59:59Z","invoicing_reason":"subscription_periodic"}]},
      {"issuing_date":"2023-09-30","total_amount_cents":5000000,"billing_periods":[{"subscription_from_datetime":"2023-08-31T00:00:00Z","subscription_to_datetime":"2023-09-29T23:59:59Z","charges_from_datetime":"2023-08-31T00:00:00Z","charges_to_datetime":"2023-09-29T23:59:59Z","invoicing_reason":"subscription_periodic"}]},
      {"issuing_date":"2023-10-31","total_amount_cents":5000000,"billing_periods":[{"subscription_from_datetime":"2023-09-30T00:00:00Z","subscription_to_datetime":"2023-10-30T23:59:59Z","charges_from_datetime":"2023-09-30T00:00:00Z","charges_to_datetime":"2023-10-30T23:59:59Z","invoicing_reason":"subscription_periodic"}]},
      {"issuing_date":"2023-11-30","total_amount_cents":5000000,"billing_periods":[{"subscription_from_datetime":"2023-10-31T00:00:00Z","subscription_to_datetime":"2023-11-29T23:59:59Z","charges_from_datetime":"2023-10-31T00:00:00Z","charges_to_datetime":"2023-11-29T23:59:59Z","invoicing_reason":"subscription_periodic"}]},
      {"issuing_date":"2023-12-31","total_amount_cents":5000000,"billing_periods":[{"subscription_from_datetime":"2023-11-30T00:00:00Z","subscription_to_datetime":"2023-12-30T23:59:59Z","charges_from_datetime":"2023-11-30T00:00:00Z","charges_to_datetime":"2023-12-30T23:59:59Z","invoicing_reason":"subscription_periodic"}]},
      {"issuing_date":"2024-01-31","total_amount_cents":5000000,"billing_periods":[{"subscription_from_datetime":"2023-12-31T00:00:00Z","subscription_to_datetime":"2024-01-30T23:59:59Z","charges_from_datetime":"2023-12-31T00:00:00Z","charges_to_datetime":"2024-01-30T23:59:59Z","invoicing_reason":"subscription_periodic"}]},
      {"issuing_date":"2024-02-29","total_amount_cents":5000000,"billing_periods":[{"subscription_from_datetime":"2024-01-31T00:00:00Z","subscription_to_datetime":"2024-02-28T23:59:59Z","charges_from_datetime":"2024-01-31T00:00:00Z","charges_to_datetime":"2024-02-28T23:59:59Z","invoicing_reason":"subscription_periodic"}]},
      {"issuing_date":"2024-03-31","total_amount_cents":5000000,"billing_periods":[{"subscription_from_datetime":"2024-02-29T00:00:00Z","subscription_to_datetime":"2024-03-30T23:59:59Z","charges_from_datetime":"2024-02-29T00:00:00Z","charges_to_datetime":"2024-03-30T23:59:59Z","invoicing_reason":"subscription_periodic"}]}
    ],
    "credit_notes": [],
    "wallets": [],
    "wallet_transactions": [],
    "fees": []
  },
  "compare": {"invoices":{"mode":"set"}}
}
