{
  "kit_schema": 1,
  "id": "scn.invoice.prepaid.001",
  "area": "scn",
  "title": "prepaid credits are capped at the invoice total with fractional fee amounts",
  "profile": "both",
  "ruling": "decided",
  "pair": null,
  "rules": ["BE-IV-31","BE-WL-44","BE-WL-45"],
  "rbd": [],
  "tags": ["premium"],
  "evidence": {"kind":"EXECUTED","by":"replay-on-lago","ref":"$API/spec/scenarios/invoices/negative_total_with_prepaid_credits_spec.rb:70","pin":"591ae9005110","runtime":"ruby-4.0.6 (pinned)","executed_at":"2026-10-02"},
  "setup": {
    "at": "2025-01-01T00:00:00Z",
    "organization": {"document_number_prefix":"ORG-0001"},
    "premium": true,
    "store": "pg",
    "taxes": [{"name":"VAT","code":"tax_1","rate":40.0}],
    "billable_metrics": [{"name":"small_metric_1","code":"small_metric_1","aggregation_type":"count_agg"},{"name":"small_metric_2","code":"small_metric_2","aggregation_type":"count_agg"},{"name":"small_metric_3","code":"small_metric_3","aggregation_type":"count_agg"},{"name":"small_metric_4","code":"small_metric_4","aggregation_type":"count_agg"},{"name":"small_metric_5","code":"small_metric_5","aggregation_type":"count_agg"},{"name":"small_metric_6","code":"small_metric_6","aggregation_type":"count_agg"},{"name":"large_metric_1","code":"large_metric_1","aggregation_type":"count_agg"},{"name":"large_metric_2","code":"large_metric_2","aggregation_type":"count_agg"}],
    "plans": [{"name":"plan_1","code":"plan_1","interval":"monthly","amount_cents":0,"amount_currency":"EUR","pay_in_advance":false,"charges":[{"code":"charge_1","billable_metric_id":"{{bm:small_metric_1}}","charge_model":"standard","properties":{"amount":"0.004"},"tax_codes":["tax_1"]},{"code":"charge_2","billable_metric_id":"{{bm:small_metric_2}}","charge_model":"standard","properties":{"amount":"0.004"},"tax_codes":["tax_1"]},{"code":"charge_3","billable_metric_id":"{{bm:small_metric_3}}","charge_model":"standard","properties":{"amount":"0.004"},"tax_codes":["tax_1"]},{"code":"charge_4","billable_metric_id":"{{bm:small_metric_4}}","charge_model":"standard","properties":{"amount":"0.004"},"tax_codes":["tax_1"]},{"code":"charge_5","billable_metric_id":"{{bm:small_metric_5}}","charge_model":"standard","properties":{"amount":"0.004"},"tax_codes":["tax_1"]},{"code":"charge_6","billable_metric_id":"{{bm:small_metric_6}}","charge_model":"standard","properties":{"amount":"0.004"},"tax_codes":["tax_1"]},{"code":"charge_7","billable_metric_id":"{{bm:large_metric_1}}","charge_model":"standard","properties":{"amount":"0.01"},"tax_codes":["tax_1"]},{"code":"charge_8","billable_metric_id":"{{bm:large_metric_2}}","charge_model":"standard","properties":{"amount":"0.01"},"tax_codes":["tax_1"]}]}],
    "customers": [{"external_id":"customer_123","currency":"EUR"}]
  },
  "steps": [
    {"op":"api","method":"POST","path":"/api/v1/subscriptions","body":{"subscription":{"external_customer_id":"customer_123","external_id":"ext_1","plan_code":"plan_1","billing_time":"anniversary"}}},
    {"op":"api","method":"POST","path":"/api/v1/wallets","body":{"wallet":{"external_customer_id":"customer_123","rate_amount":"1","currency":"EUR","granted_credits":"100","invoice_requires_successful_payment":false}}},
    {"op":"api","method":"POST","path":"/api/v1/events","body":{"event":{"code":"small_metric_1","external_customer_id":"customer_123","external_subscription_id":"ext_1","properties":{},"transaction_id":"tx_1"}}},
    {"op":"api","method":"POST","path":"/api/v1/events","body":{"event":{"code":"small_metric_2","external_customer_id":"customer_123","external_subscription_id":"ext_1","properties":{},"transaction_id":"tx_2"}}},
    {"op":"api","method":"POST","path":"/api/v1/events","body":{"event":{"code":"small_metric_3","external_customer_id":"customer_123","external_subscription_id":"ext_1","properties":{},"transaction_id":"tx_3"}}},
    {"op":"api","method":"POST","path":"/api/v1/events","body":{"event":{"code":"small_metric_4","external_customer_id":"customer_123","external_subscription_id":"ext_1","properties":{},"transaction_id":"tx_4"}}},
    {"op":"api","method":"POST","path":"/api/v1/events","body":{"event":{"code":"small_metric_5","external_customer_id":"customer_123","external_subscription_id":"ext_1","properties":{},"transaction_id":"tx_5"}}},
    {"op":"api","method":"POST","path":"/api/v1/events","body":{"event":{"code":"small_metric_6","external_customer_id":"customer_123","external_subscription_id":"ext_1","properties":{},"transaction_id":"tx_6"}}},
    {"op":"api","method":"POST","path":"/api/v1/events","body":{"event":{"code":"large_metric_1","external_customer_id":"customer_123","external_subscription_id":"ext_1","properties":{},"transaction_id":"tx_7"}}},
    {"op":"api","method":"POST","path":"/api/v1/events","body":{"event":{"code":"large_metric_2","external_customer_id":"customer_123","external_subscription_id":"ext_1","properties":{},"transaction_id":"tx_8"}}},
    {"at":"2025-02-01T00:00:00Z","op":"tick","jobs":["billing"]}
  ],
  "expect": {
    "invoices": [
      {"invoice_type":"subscription","status":"finalized","payment_status":"succeeded","number":"ORG-0001-001-001","issuing_date":"2025-02-01","payment_due_date":"2025-02-01","currency":"EUR","fees_amount_cents":2,"coupons_amount_cents":0,"progressive_billing_credit_amount_cents":0,"credit_notes_amount_cents":0,"prepaid_credit_amount_cents":3,"taxes_amount_cents":1,"sub_total_excluding_taxes_amount_cents":2,"sub_total_including_taxes_amount_cents":3,"total_amount_cents":0,"total_due_amount_cents":0,"billing_periods":[{"subscription_from_datetime":"2025-01-01T00:00:00Z","subscription_to_datetime":"2025-01-31T23:59:59Z","charges_from_datetime":"2025-01-01T00:00:00Z","charges_to_datetime":"2025-01-31T23:59:59Z","invoicing_reason":"subscription_periodic"}],"fees":[{"item":{"type":"charge","code":"small_metric_1"},"amount_cents":0,"units":"1.0","events_count":1,"taxes_amount_cents":0,"taxes_rate":40.0,"from_date":"2025-01-01T00:00:00+00:00","to_date":"2025-01-31T23:59:59+00:00"},{"item":{"type":"charge","code":"small_metric_2"},"amount_cents":0,"units":"1.0","events_count":1,"taxes_amount_cents":0,"taxes_rate":40.0,"from_date":"2025-01-01T00:00:00+00:00","to_date":"2025-01-31T23:59:59+00:00"},{"item":{"type":"charge","code":"large_metric_2"},"amount_cents":1,"units":"1.0","events_count":1,"taxes_amount_cents":0,"taxes_rate":40.0,"from_date":"2025-01-01T00:00:00+00:00","to_date":"2025-01-31T23:59:59+00:00"},{"item":{"type":"charge","code":"small_metric_6"},"amount_cents":0,"units":"1.0","events_count":1,"taxes_amount_cents":0,"taxes_rate":40.0,"from_date":"2025-01-01T00:00:00+00:00","to_date":"2025-01-31T23:59:59+00:00"},{"item":{"type":"charge","code":"small_metric_5"},"amount_cents":0,"units":"1.0","events_count":1,"taxes_amount_cents":0,"taxes_rate":40.0,"from_date":"2025-01-01T00:00:00+00:00","to_date":"2025-01-31T23:59:59+00:00"},{"item":{"type":"charge","code":"small_metric_4"},"amount_cents":0,"units":"1.0","events_count":1,"taxes_amount_cents":0,"taxes_rate":40.0,"from_date":"2025-01-01T00:00:00+00:00","to_date":"2025-01-31T23:59:59+00:00"},{"item":{"type":"charge","code":"large_metric_1"},"amount_cents":1,"units":"1.0","events_count":1,"taxes_amount_cents":0,"taxes_rate":40.0,"from_date":"2025-01-01T00:00:00+00:00","to_date":"2025-01-31T23:59:59+00:00"},{"item":{"type":"subscription"},"amount_cents":0,"units":"1.0","taxes_amount_cents":0,"from_date":"2025-01-01T00:00:00+00:00","to_date":"2025-01-31T23:59:59+00:00"},{"item":{"type":"charge","code":"small_metric_3"},"amount_cents":0,"units":"1.0","events_count":1,"taxes_amount_cents":0,"taxes_rate":40.0,"from_date":"2025-01-01T00:00:00+00:00","to_date":"2025-01-31T23:59:59+00:00"}],"applied_taxes":[{"tax_code":"tax_1","tax_rate":40.0,"amount_cents":1,"fees_amount_cents":2}]}
    ],
    "credit_notes": [],
    "wallets": [
      {"status":"active","currency":"EUR","code":"default","priority":50,"rate_amount":"1.0","credits_balance":"99.97","balance_cents":9997,"consumed_credits":"0.03","ongoing_balance_cents":9997,"ongoing_usage_balance_cents":0,"credits_ongoing_balance":"99.97","credits_ongoing_usage_balance":"0.0"}
    ],
    "wallet_transactions": [
      {"status":"settled","transaction_status":"granted","transaction_type":"inbound","source":"manual","amount":"100.0","credit_amount":"100.0","priority":50},
      {"status":"settled","transaction_status":"invoiced","transaction_type":"outbound","source":"manual","amount":"0.03","credit_amount":"0.03","priority":50}
    ],
    "fees": []
  },
  "compare": {"invoices[*].fees":{"mode":"set"},"wallet_transactions":{"mode":"set"}}
}
