{
  "kit_schema": 1,
  "id": "scn.subscription.billing.001",
  "area": "scn",
  "title": "monthly calendar arrears plan billed once per billing day",
  "profile": "both",
  "ruling": "decided",
  "pair": null,
  "rules": ["BE-DM-15"],
  "rbd": ["RBD-94"],
  "tags": ["core"],
  "evidence": {"kind":"EXECUTED","by":"replay-on-lago","ref":"$API/spec/scenarios/subscriptions/billing_spec.rb:25","pin":"591ae9005110","runtime":"ruby-4.0.6 (pinned)","executed_at":"2026-10-02"},
  "setup": {
    "at": "2023-02-04T00:00:00Z",
    "organization": {"document_number_prefix":"ORG-0001"},
    "premium": false,
    "store": "pg",
    "plans": [{"name":"plan_1","code":"plan_1","interval":"monthly","amount_cents":5000000,"amount_currency":"GBP","pay_in_advance":false}],
    "customers": [{"external_id":"cust_1","currency":"GBP"}]
  },
  "steps": [
    {"op":"api","method":"POST","path":"/api/v1/subscriptions","body":{"subscription":{"external_customer_id":"cust_1","external_id":"cust_1","plan_code":"plan_1","billing_time":"calendar"}}},
    {"at":"2023-02-28T00:00:00Z","op":"tick","jobs":["billing"]},
    {"at":"2023-03-01T01:00:00Z","op":"tick","jobs":["billing"]},
    {"at":"2023-03-01T02:00:00Z","op":"tick","jobs":["billing"]},
    {"at":"2023-03-02T00:00:00Z","op":"tick","jobs":["billing"]}
  ],
  "expect": {
    "invoices": [
      {"invoice_type":"subscription","status":"finalized","payment_status":"pending","number":"ORG-0001-001-001","issuing_date":"2023-03-01","payment_due_date":"2023-03-01","currency":"GBP","fees_amount_cents":4464286,"coupons_amount_cents":0,"progressive_billing_credit_amount_cents":0,"credit_notes_amount_cents":0,"prepaid_credit_amount_cents":0,"taxes_amount_cents":0,"sub_total_excluding_taxes_amount_cents":4464286,"sub_total_including_taxes_amount_cents":4464286,"total_amount_cents":4464286,"total_due_amount_cents":4464286,"billing_periods":[{"subscription_from_datetime":"2023-02-04T00:00:00Z","subscription_to_datetime":"2023-02-28T23:59:59Z","charges_from_datetime":"2023-02-04T00:00:00Z","charges_to_datetime":"2023-02-28T23:59:59Z","invoicing_reason":"subscription_periodic"}],"fees":[{"item":{"type":"subscription"},"amount_cents":4464286,"units":"1.0","taxes_amount_cents":0,"from_date":"2023-02-04T00:00:00+00:00","to_date":"2023-02-28T23:59:59+00:00"}]}
    ],
    "credit_notes": [],
    "wallets": [],
    "wallet_transactions": [],
    "fees": []
  }
}
