{
  "kit_schema": 1,
  "id": "scn.fixed_charge.units.001",
  "area": "scn",
  "title": "fixed charge units raised mid-period: delta invoice in advance",
  "profile": "both",
  "ruling": "decided",
  "pair": null,
  "rules": ["BE-PR-67","BE-PR-71"],
  "rbd": [],
  "tags": ["premium"],
  "evidence": {"kind":"EXECUTED","by":"replay-on-lago","ref":"$API/spec/scenarios/fixed_charges/pay_in_advance_units_change_spec.rb:133","pin":"591ae9005110","runtime":"ruby-4.0.6 (pinned)","executed_at":"2026-10-02"},
  "setup": {
    "at": "2024-03-01T00:00:00Z",
    "organization": {"document_number_prefix":"ORG-0001"},
    "premium": true,
    "store": "pg",
    "add_ons": [{"name":"add_on_1","code":"add_on_1","amount_cents":200,"amount_currency":"EUR"}],
    "plans": [{"name":"plan_1","code":"plan_1","interval":"monthly","amount_cents":0,"amount_currency":"EUR","pay_in_advance":true,"fixed_charges":[{"code":"fixed_charge_1","add_on_id":"{{add_on:add_on_1}}","charge_model":"standard","units":"10.0","pay_in_advance":true,"properties":{"amount":"10"}}]}],
    "customers": [{"external_id":"cust_1","currency":"EUR"}]
  },
  "steps": [
    {"op":"api","method":"POST","path":"/api/v1/subscriptions","body":{"subscription":{"external_customer_id":"cust_1","external_id":"sub_cust_1","plan_code":"plan_1","billing_time":"calendar"}}},
    {"at":"2024-03-06T00:00:00Z","op":"api","method":"PUT","path":"/api/v1/plans/plan_1","body":{"plan":{"fixed_charges":[{"id":"{{fixed_charge:plan_1:fixed_charge_1}}","units":15,"apply_units_immediately":true,"properties":{"amount":"10"}}]}}}
  ],
  "expect": {
    "invoices": [
      {"invoice_type":"subscription","status":"finalized","payment_status":"pending","number":"ORG-0001-001-001","issuing_date":"2024-03-01","payment_due_date":"2024-03-01","currency":"EUR","fees_amount_cents":10000,"coupons_amount_cents":0,"progressive_billing_credit_amount_cents":0,"credit_notes_amount_cents":0,"prepaid_credit_amount_cents":0,"taxes_amount_cents":0,"sub_total_excluding_taxes_amount_cents":10000,"sub_total_including_taxes_amount_cents":10000,"total_amount_cents":10000,"total_due_amount_cents":10000,"billing_periods":[{"subscription_from_datetime":"2024-03-01T00:00:00Z","subscription_to_datetime":"2024-03-31T23:59:59Z","charges_from_datetime":"2024-03-01T00:00:00Z","charges_to_datetime":"2024-03-01T00:00:00Z","invoicing_reason":"subscription_starting"}],"fees":[{"item":{"type":"subscription"},"pay_in_advance":true,"amount_cents":0,"units":"1.0","taxes_amount_cents":0,"from_date":"2024-03-01T00:00:00+00:00","to_date":"2024-03-31T23:59:59+00:00"},{"item":{"type":"fixed_charge","code":"add_on_1"},"pay_in_advance":true,"amount_cents":10000,"units":"10.0","taxes_amount_cents":0,"from_date":"2024-03-01T00:00:00+00:00","to_date":"2024-03-31T23:59:59+00:00"}]},
      {"invoice_type":"subscription","status":"finalized","payment_status":"pending","number":"ORG-0001-001-002","issuing_date":"2024-03-06","payment_due_date":"2024-03-06","currency":"EUR","fees_amount_cents":5000,"coupons_amount_cents":0,"progressive_billing_credit_amount_cents":0,"credit_notes_amount_cents":0,"prepaid_credit_amount_cents":0,"taxes_amount_cents":0,"sub_total_excluding_taxes_amount_cents":5000,"sub_total_including_taxes_amount_cents":5000,"total_amount_cents":5000,"total_due_amount_cents":5000,"billing_periods":[{"subscription_from_datetime":"2024-03-01T00:00:00Z","subscription_to_datetime":"2024-03-31T23:59:59Z","charges_from_datetime":"2024-03-01T00:00:00Z","charges_to_datetime":"2024-03-01T00:00:00Z","invoicing_reason":"in_advance_charge"}],"fees":[{"item":{"type":"fixed_charge","code":"add_on_1"},"pay_in_advance":true,"amount_cents":5000,"units":"5.0","taxes_amount_cents":0,"from_date":"2024-03-01T00:00:00+00:00","to_date":"2024-03-31T23:59:59+00:00"}]}
    ],
    "credit_notes": [],
    "wallets": [],
    "wallet_transactions": [],
    "fees": []
  },
  "compare": {"invoices":{"mode":"set"},"invoices[*].fees":{"mode":"set"}}
}
