{
  "kit_schema": 1,
  "id": "scn.usage.standard.002",
  "area": "scn",
  "title": "current usage, standard model grouped by a property",
  "profile": "both",
  "ruling": "decided",
  "pair": null,
  "rules": ["BE-PR-5","BE-AG-36"],
  "rbd": [],
  "tags": [],
  "evidence": {"kind":"EXECUTED","by":"replay-on-lago","ref":"$API/spec/scenarios/current_usage/by_charge_model/standard_spec.rb:53","pin":"591ae9005110","runtime":"ruby-4.0.6 (pinned)","executed_at":"2026-10-02"},
  "setup": {
    "at": "2024-03-05T00:00:00Z",
    "organization": {"document_number_prefix":"ORG-0001"},
    "premium": false,
    "store": "pg",
    "billable_metrics": [{"name":"metric_1","code":"metric_1","aggregation_type":"count_agg"}],
    "plans": [{"name":"plan_1","code":"plan_1","interval":"monthly","amount_cents":0,"amount_currency":"EUR","pay_in_advance":false,"charges":[{"code":"charge_1","billable_metric_id":"{{bm:metric_1}}","charge_model":"standard","properties":{"amount":"10","grouped_by":["region"],"pricing_group_keys":["region"]}}]}],
    "customers": [{"external_id":"cust_1","currency":"EUR"}]
  },
  "steps": [
    {"op":"api","method":"POST","path":"/api/v1/subscriptions","body":{"subscription":{"external_customer_id":"cust_1","external_id":"cust_1","plan_code":"plan_1"}}},
    {"at":"2024-03-06T00:00:00Z","op":"api","method":"POST","path":"/api/v1/events","body":{"event":{"code":"metric_1","transaction_id":"tx_1","external_subscription_id":"cust_1","properties":{"region":"us"}}}},
    {"op":"api","method":"POST","path":"/api/v1/events","body":{"event":{"code":"metric_1","transaction_id":"tx_2","external_subscription_id":"cust_1","properties":{"region":"us"}}}},
    {"op":"api","method":"POST","path":"/api/v1/events","body":{"event":{"code":"metric_1","transaction_id":"tx_3","external_subscription_id":"cust_1","properties":{"region":"eu"}}}},
    {"op":"api","method":"GET","path":"/api/v1/customers/cust_1/current_usage","query":{"external_subscription_id":"cust_1"},"compare":{"body.customer_usage.charges_usage[*].grouped_usage":{"mode":"set"}},"expect":{"status":200,"body":{"customer_usage":{"from_datetime":"2024-03-05T00:00:00Z","to_datetime":"2024-03-31T23:59:59Z","issuing_date":"2024-03-31","currency":"EUR","amount_cents":3000,"total_amount_cents":3000,"taxes_amount_cents":0,"charges_usage":[{"units":"3.0","total_aggregated_units":"3.0","events_count":3,"amount_cents":3000,"amount_currency":"EUR","charge":{"code":"charge_1","charge_model":"standard"},"billable_metric":{"code":"metric_1","aggregation_type":"count_agg"},"filters":[],"grouped_usage":[{"units":"1.0","total_aggregated_units":"1.0","events_count":1,"amount_cents":1000,"grouped_by":{"region":"eu"},"filters":[]},{"units":"2.0","total_aggregated_units":"2.0","events_count":2,"amount_cents":2000,"grouped_by":{"region":"us"},"filters":[]}]}]}}}}
  ],
  "expect": {
    "invoices": [],
    "credit_notes": [],
    "wallets": [],
    "wallet_transactions": [],
    "fees": []
  }
}
