{
  "kit_schema": 1,
  "id": "scn.store_ch.weighted_sum.001",
  "area": "scn",
  "title": "columnar store: weighted sum usage and invoices",
  "profile": "both",
  "ruling": "decided",
  "pair": null,
  "rules": ["BE-AG-17"],
  "rbd": ["RBD-29"],
  "tags": ["store-ch","optional"],
  "evidence": {"kind":"EXECUTED","by":"replay-on-lago","ref":"$API/spec/scenarios/current_usage/by_aggregation_type/weighted_sum_agg_spec.rb:20","pin":"591ae9005110","runtime":"ruby-4.0.6 (pinned)","executed_at":"2026-10-02"},
  "setup": {
    "at": "2023-03-05T00:00:00Z",
    "organization": {"document_number_prefix":"ORG-0001"},
    "premium": false,
    "store": "ch",
    "billable_metrics": [{"name":"metric_1","code":"metric_1","aggregation_type":"weighted_sum_agg","field_name":"value","weighted_interval":"seconds","recurring":true}],
    "plans": [{"name":"plan_1","code":"plan_1","interval":"monthly","amount_cents":0,"amount_currency":"EUR","pay_in_advance":false,"charges":[{"code":"charge_1","billable_metric_id":"{{bm:metric_1}}","charge_model":"standard","properties":{"amount":"1"}}]}],
    "customers": [{"external_id":"cust_1","currency":"EUR"}]
  },
  "steps": [
    {"op":"api","method":"POST","path":"/api/v1/subscriptions","body":{"subscription":{"external_customer_id":"cust_1","external_id":"cust_1","plan_code":"plan_1"}}},
    {"op":"api","method":"POST","path":"/api/v1/events","body":{"event":{"code":"metric_1","external_subscription_id":"cust_1","properties":{"value":"2500"},"transaction_id":"tx_1"}}},
    {"op":"api","method":"GET","path":"/api/v1/customers/cust_1/current_usage","query":{"external_subscription_id":"cust_1"},"expect":{"status":200,"body":{"customer_usage":{"from_datetime":"2023-03-05T00:00:00Z","to_datetime":"2023-03-31T23:59:59Z","issuing_date":"2023-03-31","currency":"EUR","amount_cents":217742,"total_amount_cents":217742,"taxes_amount_cents":0,"charges_usage":[{"units":"2177.41935483870967741936","total_aggregated_units":"2500.0","events_count":1,"amount_cents":217742,"amount_currency":"EUR","charge":{"code":"charge_1","charge_model":"standard"},"billable_metric":{"code":"metric_1","aggregation_type":"weighted_sum_agg"},"filters":[]}]}}}},
    {"at":"2023-04-01T00:00:00Z","op":"tick","jobs":["billing"]},
    {"at":"2023-04-04T00:00:00Z","op":"api","method":"POST","path":"/api/v1/events","body":{"event":{"code":"metric_1","external_subscription_id":"cust_1","properties":{"value":"-2000"},"transaction_id":"tx_2"}}},
    {"at":"2023-04-06T00:00:00Z","op":"api","method":"POST","path":"/api/v1/events","body":{"event":{"code":"metric_1","external_subscription_id":"cust_1","properties":{"value":"-200"},"transaction_id":"tx_3"}}},
    {"op":"api","method":"GET","path":"/api/v1/customers/cust_1/current_usage","query":{"external_subscription_id":"cust_1"},"expect":{"status":200,"body":{"customer_usage":{"from_datetime":"2023-04-01T00:00:00Z","to_datetime":"2023-04-30T23:59:59Z","issuing_date":"2023-04-30","currency":"EUR","amount_cents":53333,"total_amount_cents":53333,"taxes_amount_cents":0,"charges_usage":[{"units":"533.33333333333333333334","total_aggregated_units":"300.0","events_count":2,"amount_cents":53333,"amount_currency":"EUR","charge":{"code":"charge_1","charge_model":"standard"},"billable_metric":{"code":"metric_1","aggregation_type":"weighted_sum_agg"},"filters":[]}]}}}},
    {"at":"2023-05-01T00:00:00Z","op":"tick","jobs":["billing"]}
  ],
  "expect": {
    "invoices": [
      {"invoice_type":"subscription","status":"finalized","payment_status":"pending","number":"ORG-0001-001-001","issuing_date":"2023-04-01","payment_due_date":"2023-04-01","currency":"EUR","fees_amount_cents":217742,"coupons_amount_cents":0,"progressive_billing_credit_amount_cents":0,"credit_notes_amount_cents":0,"prepaid_credit_amount_cents":0,"taxes_amount_cents":0,"sub_total_excluding_taxes_amount_cents":217742,"sub_total_including_taxes_amount_cents":217742,"total_amount_cents":217742,"total_due_amount_cents":217742,"billing_periods":[{"subscription_from_datetime":"2023-03-05T00:00:00Z","subscription_to_datetime":"2023-03-31T23:59:59Z","charges_from_datetime":"2023-03-05T00:00:00Z","charges_to_datetime":"2023-03-31T23:59:59Z","invoicing_reason":"subscription_periodic"}],"fees":[{"item":{"type":"subscription"},"amount_cents":0,"units":"1.0","taxes_amount_cents":0,"from_date":"2023-03-05T00:00:00+00:00","to_date":"2023-03-31T23:59:59+00:00"},{"item":{"type":"charge","code":"metric_1"},"amount_cents":217742,"units":"2177.41935483870967741936","events_count":1,"taxes_amount_cents":0,"from_date":"2023-03-05T00:00:00+00:00","to_date":"2023-03-31T23:59:59+00:00"}]},
      {"invoice_type":"subscription","status":"finalized","payment_status":"pending","number":"ORG-0001-001-002","issuing_date":"2023-05-01","payment_due_date":"2023-05-01","currency":"EUR","fees_amount_cents":53333,"coupons_amount_cents":0,"progressive_billing_credit_amount_cents":0,"credit_notes_amount_cents":0,"prepaid_credit_amount_cents":0,"taxes_amount_cents":0,"sub_total_excluding_taxes_amount_cents":53333,"sub_total_including_taxes_amount_cents":53333,"total_amount_cents":53333,"total_due_amount_cents":53333,"billing_periods":[{"subscription_from_datetime":"2023-04-01T00:00:00Z","subscription_to_datetime":"2023-04-30T23:59:59Z","charges_from_datetime":"2023-04-01T00:00:00Z","charges_to_datetime":"2023-04-30T23:59:59Z","invoicing_reason":"subscription_periodic"}],"fees":[{"item":{"type":"subscription"},"amount_cents":0,"units":"1.0","taxes_amount_cents":0,"from_date":"2023-04-01T00:00:00+00:00","to_date":"2023-04-30T23:59:59+00:00"},{"item":{"type":"charge","code":"metric_1"},"amount_cents":53333,"units":"533.33333333333333333334","events_count":2,"taxes_amount_cents":0,"from_date":"2023-04-01T00:00:00+00:00","to_date":"2023-04-30T23:59:59+00:00"}]}
    ],
    "credit_notes": [],
    "wallets": [],
    "wallet_transactions": [],
    "fees": []
  },
  "compare": {"invoices":{"mode":"set"},"invoices[*].fees":{"mode":"set"}}
}
